titulo,precio,fecha_publicacion,hora_publicacion,lugar_venta
Celular Huawei Mate 20,100000,24-08-2023,12:32:02,"Vitacura, Región Metropolitana"
Huawei nova y70,65000,24-08-2023,12:02:38,"Pudahuel, Región Metropolitana"
"Smartwatch Samsung, Huawei band 4 pro",70000,24-08-2023,09:19:08,"El Monte, Región Metropolitana"
HUAWEI Watch GT3 pro,200000,24-08-2023,02:31:04,"Las Condes, Región Metropolitana"
Celular Huawei Mate 20 Lite 64 GB 4 GB ram,45000,23-08-2023,21:09:10,"Puente Alto, Región Metropolitana"
Huawei Mate 20,85000,23-08-2023,17:30:38,"Las Condes, Región Metropolitana"
Baterias de litio narada y huawei nuevas embaladas,240000,23-08-2023,07:10:28,"Puente Alto, Región Metropolitana"
Huawei P30pro 256Gb como nuevo,25900,22-08-2023,15:21:47,"Melipilla, Región Metropolitana"
Camara Trasera Huawei P30 Lite,65000,22-08-2023,11:49:19,"Macul, Región Metropolitana"
Huawei mate20 lite SNE - LX3 liberado,75000,22-08-2023,10:59:45,"Ñuñoa, Región Metropolitana"
Celular huawei y9s,45000,22-08-2023,00:18:39,"San Bernardo, Región Metropolitana"
Huawei watch gt,140000,21-08-2023,23:41:51,"Recoleta, Región Metropolitana"
Tablet Huawei matepad,20000,21-08-2023,23:32:46,"La Florida, Región Metropolitana"
Huawei band 6,180000,21-08-2023,17:28:02,"Lampa, Región Metropolitana"
Teléfono Huawei mate 10 pro,4500,21-08-2023,16:53:06,"San Ramón, Región Metropolitana"
Lente cámara trasera huawei p20,5500,21-08-2023,12:10:00,"Macul, Región Metropolitana"
Lente Camara Trasera Huawei P40 Lite,490000,21-08-2023,11:55:03,"Macul, Región Metropolitana"
Lente Camara Trasera Huawei P30 Pro,85000,21-08-2023,11:54:50,"Macul, Región Metropolitana"
Huawei p50 pro Gold,25000,20-08-2023,21:36:35,"Colina, Región Metropolitana"
Huawei M-Pencil 1nd gen + cargador y puntas,120000,20-08-2023,21:03:43,"Vitacura, Región Metropolitana"
Funda Huawei matepad 10.4,60000,20-08-2023,21:00:49,"Vitacura, Región Metropolitana"
Celular Huawei mate 20 pro,65000,20-08-2023,15:14:54,"San Miguel, Región Metropolitana"
Teléfono Celular Huawei Y7 2019,20000,20-08-2023,14:59:41,"Maipú, Región Metropolitana"
Huawei Watch fit 2,45000,19-08-2023,20:56:17,"Padre Hurtado, Región Metropolitana"
Huawei gr5,45000,19-08-2023,10:43:35,"Quilicura, Región Metropolitana"
Smartwatch huawei,20000,18-08-2023,22:51:34,"Las Condes, Región Metropolitana"
Celular Huawei Y7 2019 dual sim,50000,18-08-2023,22:08:32,"Santiago, Región Metropolitana"
Huawei gr5,45000,18-08-2023,19:55:59,"Quilicura, Región Metropolitana"
Huawei p30lite rosado pantalla quebrada,135000,18-08-2023,02:39:18,"Estación Central, Región Metropolitana"
Huawei P30 pantalla quebrada,80000,18-08-2023,01:01:04,"Estación Central, Región Metropolitana"
Huawei p30 Normal excelente,150000,17-08-2023,18:22:55,"La Florida, Región Metropolitana"
Huawei P20 128Gb 6RAM,85000,17-08-2023,14:08:54,"Maipú, Región Metropolitana"
Huawei nova 9se,35000,16-08-2023,22:41:17,"Puente Alto, Región Metropolitana"
Huawei Y9s,40000,16-08-2023,22:35:38,"Santiago, Región Metropolitana"
Huawei mate 10 Lite 128 gb impecable ,80000,16-08-2023,13:55:07,"Macul, Región Metropolitana"
Huawei fit watch,90000,16-08-2023,11:48:01,"Providencia, Región Metropolitana"
Smart Watch huawei,30000,16-08-2023,11:25:58,"Pedro Aguirre Cerda, Región Metropolitana"
Smart Watch huawei gt2e,60000,16-08-2023,11:22:17,"Pedro Aguirre Cerda, Región Metropolitana"
Huawei nova y60,40000,16-08-2023,10:14:38,"Recoleta, Región Metropolitana"
Huawei p 40 lite,80000,16-08-2023,09:51:02,"Santiago, Región Metropolitana"
Smartwatch HUAWEI GT,90000,16-08-2023,08:16:22,"Estación Central, Región Metropolitana"
Reloj smartwatch huawei gt3,35000,16-08-2023,04:29:52,"La Florida, Región Metropolitana"
Reloj Huawei Gt2 pro,100000,15-08-2023,19:55:00,"Cerro Navia, Región Metropolitana"
Huawei Mobile Wifi,80000,15-08-2023,18:03:10,"Quilicura, Región Metropolitana"
Huawei mate 20,165000,15-08-2023,16:11:24,"Puente Alto, Región Metropolitana"
Watch 3 sport Huawei,100000,14-08-2023,17:12:48,"Santiago, Región Metropolitana"
Huawei p40 Lite ,35000,14-08-2023,14:25:04,"La Granja, Región Metropolitana"
Bateria Para Huawei P30 Lite,10990,14-08-2023,11:48:44,"Macul, Región Metropolitana"
Huawei Nova 9,200000,13-08-2023,23:47:42,"Santiago, Región Metropolitana"
Celular Huawei mate 20 lite,140000,13-08-2023,23:46:53,"Santiago, Región Metropolitana"
Celular huawei p9 lite,50000,13-08-2023,23:46:00,"Santiago, Región Metropolitana"
Celular Huawei Mate 20 Lite dorado,120000,13-08-2023,18:50:48,"Pudahuel, Región Metropolitana"
Huawei Band 6 -C09,25000,13-08-2023,10:34:06,"Puente Alto, Región Metropolitana"
Celular Huawei nova,110000,13-08-2023,03:10:39,"Vitacura, Región Metropolitana"
Huawei P30 Pro,360000,12-08-2023,22:32:32,"Ñuñoa, Región Metropolitana"
Huawei Band 6,15000,12-08-2023,19:41:49,"San Miguel, Región Metropolitana"
Huawei band 7,40000,12-08-2023,13:31:44,"La Granja, Región Metropolitana"
Pantalla para huawei p30 oled,27500,12-08-2023,12:10:27,"Macul, Región Metropolitana"
Pantalla lcd + tactil huawei p20 lite,28000,12-08-2023,12:10:19,"Macul, Región Metropolitana"
Huawei g7010 antiguo,50000,12-08-2023,11:00:17,"Macul, Región Metropolitana"
Teléfono Huawei ,50000,11-08-2023,16:35:00,"Providencia, Región Metropolitana"
Huawei P30 lite con Android,180000,11-08-2023,11:02:35,"Estación Central, Región Metropolitana"
Huawei P20 PRO,50000,11-08-2023,10:17:42,"Peñaflor, Región Metropolitana"
Huawei P smart 2019,260000,10-08-2023,16:55:25,"La Florida, Región Metropolitana"
Huawei mate 30 pro dúos,50000,10-08-2023,14:03:36,"La Reina, Región Metropolitana"
Huawei y9 2019,75000,10-08-2023,12:47:24,"Ñuñoa, Región Metropolitana"
Smart watch Huawei GT 2 con 2 accesorios extras,120000,09-08-2023,23:06:21,"La Reina, Región Metropolitana"
Reloj Huawei gt2pro,89000,09-08-2023,20:01:28,"Cerrillos, Región Metropolitana"
Huawei P40 lite,90000,09-08-2023,15:16:04,"Santiago, Región Metropolitana"
Huawei Y9 prime,300000,09-08-2023,07:41:23,"San Bernardo, Región Metropolitana"
Huawei P40 8/128,80000,09-08-2023,00:04:03,"Recoleta, Región Metropolitana"
Huawei redmi 10 5g,40000,08-08-2023,20:06:35,"Talagante, Región Metropolitana"
Reloj Marca Huawei pro 3,1800,08-08-2023,18:32:58,"San Joaquín, Región Metropolitana"
Lamina Protectora Para Huawei Watch Fit 2,60000,08-08-2023,14:43:04,"Ñuñoa, Región Metropolitana"
Smartwatch Huawei Watch GT 2,9900,07-08-2023,15:53:41,"Ñuñoa, Región Metropolitana"
Flex de Encendido Apagado Y Volumen Huawei P10,90000,07-08-2023,11:35:19,"Macul, Región Metropolitana"
Tablet huawei matepad 10 pulgadas,300000,07-08-2023,09:26:49,"Santiago, Región Metropolitana"
Huawei matepad pro 10.8 6|128,70000,06-08-2023,16:19:04,"San Miguel, Región Metropolitana"
Huawei Y9,450000,06-08-2023,13:39:38,"Ñuñoa, Región Metropolitana"
Huawei mate 40 pro IMPECABLE ,139990,03-08-2023,19:11:08,"El Bosque, Región Metropolitana"
Huawei watch Gt Runner,120000,03-08-2023,15:38:02,"Las Condes, Región Metropolitana"
Celular Huawei P30 Light,80000,03-08-2023,14:36:47,"San Joaquín, Región Metropolitana"
Huawei Watch GT 2: Elegancia y Resistencia,5900,03-08-2023,13:40:34,"San Miguel, Región Metropolitana"
Bandeja sim para huawei mate 8,20000,03-08-2023,12:13:31,"Macul, Región Metropolitana"
Huawei y7 ,45000,02-08-2023,16:32:01,"La Granja, Región Metropolitana"
Huawei y7 2019,25000,02-08-2023,13:39:34,"Puente Alto, Región Metropolitana"
Bateria huawei mate 10 pro,75000,02-08-2023,13:21:32,"Macul, Región Metropolitana"
Huawei watch fit elegant,45000,02-08-2023,10:57:29,"Santiago, Región Metropolitana"
Celular huawei y 2019,9500,02-08-2023,09:31:49,"Puente Alto, Región Metropolitana"
Correa Deportiva Transparente Para Huawei WatchFit,150,02-08-2023,08:08:14,"Ñuñoa, Región Metropolitana"
Huawei y9s,70000,01-08-2023,22:32:30,"Colina, Región Metropolitana"
Smartwatch huawei gt2 Pro,120000,01-08-2023,21:47:20,"Puente Alto, Región Metropolitana"
Correa De Reloj Transparente Para Huawei Watch Gt2,8500,01-08-2023,17:10:24,"Ñuñoa, Región Metropolitana"
Correa De Reloj Completa Mate Para Huawei WatchGt2,8500,01-08-2023,17:02:38,"Ñuñoa, Región Metropolitana"
"Correa De Silicona Para Huawei Watch Gt2 Pro , 22m",6500,01-08-2023,16:32:31,"Ñuñoa, Región Metropolitana"
Hawei P30 lite,60000,01-08-2023,15:59:33,"Santiago, Región Metropolitana"
Huawei watch gt3 Se,80000,01-08-2023,13:39:41,"Independencia, Región Metropolitana"
Smartband huawei 4 pro,40000,01-08-2023,13:34:53,"Puente Alto, Región Metropolitana"
Bateria Huawei P9 / P8 P9 P10 P20 Lite Honor 8,9900,01-08-2023,11:59:36,"Macul, Región Metropolitana"
Parlante Altavoz Huawei Mate 9,8900,01-08-2023,11:57:10,"Macul, Región Metropolitana"
Altavoz Parlante Huawei Mate 8,9800,01-08-2023,11:55:25,"Macul, Región Metropolitana"
Smartphone Huawei nova 8i,120000,01-08-2023,10:36:43,"Maipú, Región Metropolitana"
Funda - Carcasa De Pantalla Para Huawei Watch Fit,6900,01-08-2023,10:25:44,"Ñuñoa, Región Metropolitana"
Correa De Silicona De Hoyos Para Huawei WatchFit 2,8900,01-08-2023,10:20:58,"Ñuñoa, Región Metropolitana"
Huawei p30 lite,122000,01-08-2023,07:47:24,"Las Condes, Región Metropolitana"
Huawei P30 Lite,90000,31-07-2023,22:04:58,"Providencia, Región Metropolitana"
Huawei watch fit,50000,31-07-2023,17:31:42,"Peñalolén, Región Metropolitana"
Celular Huawei P20 Lite usado,60000,31-07-2023,12:37:46,"Santiago, Región Metropolitana"
Celular Huawei P20 Lite usado,60000,31-07-2023,12:08:07,"Santiago, Región Metropolitana"
Pantalla Huawei PSMART 2018,39900,31-07-2023,11:32:28,"Macul, Región Metropolitana"
Pantalla Huawei PSMART 2019,45000,31-07-2023,11:28:52,"Macul, Región Metropolitana"
Smartphone Huawei P10 lite,40,30-07-2023,19:03:36,"Puente Alto, Región Metropolitana"
Correa Metalica Para Huawei Watch Fit 2,10500,30-07-2023,11:53:36,"Ñuñoa, Región Metropolitana"
Huawei watch 3 BLACK,80000,29-07-2023,01:46:17,"Maipú, Región Metropolitana"
Reloj Inteligente HUAWEI WATCH 3 - NUEVO,145000,28-07-2023,18:31:47,"Providencia, Región Metropolitana"
Huawei Nova 5T,20000,28-07-2023,16:37:40,"Vitacura, Región Metropolitana"
HUAWEI WATCH GT 2 Pro,135000,28-07-2023,16:05:25,"Estación Central, Región Metropolitana"
Huawei Smart Watch G2,60000,28-07-2023,11:12:08,"La Reina, Región Metropolitana"
Carcasa De Pantalla Completa Para Huawei Gt2 46mm,6900,28-07-2023,08:52:33,"Ñuñoa, Región Metropolitana"
Funda Carcasa Rigida Completa Para Huawei Gt2 46mm,8500,28-07-2023,08:52:16,"Ñuñoa, Región Metropolitana"
Tablet Huawei Matepad Pro 10.8,220000,27-07-2023,23:29:03,"Quilicura, Región Metropolitana"
Huawei Nova 8i ,120000,27-07-2023,18:35:03,"Santiago, Región Metropolitana"
Huawei watch Fit elegant,49990,27-07-2023,16:13:29,"Santiago, Región Metropolitana"
Bateria de Huawei P30 LITE,10900,27-07-2023,11:37:33,"Macul, Región Metropolitana"
Correa Nylon Smartwatch Huawei Fit-,7990,27-07-2023,08:48:51,"Ñuñoa, Región Metropolitana"
Correa Nylon Elastica Para Samsung Huawei 20mm,8000,27-07-2023,08:14:37,"Ñuñoa, Región Metropolitana"
Huawei p30 Lite,70000,25-07-2023,13:00:09,"Ñuñoa, Región Metropolitana"
Smartwatch Huawei fit 2 negro,65000,25-07-2023,12:55:09,"Recoleta, Región Metropolitana"
Correa De Silicona Para Huawei Watch Fit 2,7700,25-07-2023,09:38:53,"Ñuñoa, Región Metropolitana"
Funda Carcasa De Pantalla Para Huawei Watch Fit 2,7700,24-07-2023,18:48:52,"Ñuñoa, Región Metropolitana"
Celular Huawei p smart 2019,60000,24-07-2023,18:45:01,Todo Chile
Correa De Silicona Para Huawei Watch Fit 1,7500,24-07-2023,18:43:49,"Ñuñoa, Región Metropolitana"
Lamina Protectora De Pantalla Para Huawei Fit 2,2500,24-07-2023,15:19:42,"Ñuñoa, Región Metropolitana"
Celular huawei y8 para repuesto,15000,22-07-2023,20:54:04,"Estación Central, Región Metropolitana"
Smartphone Huawei,120000,22-07-2023,10:26:48,"La Florida, Región Metropolitana"
Smartwatch Huawei gt3,80000,20-07-2023,19:46:01,"Independencia, Región Metropolitana"
Huawei nova 5T azul,80000,20-07-2023,18:49:42,"Santiago, Región Metropolitana"
Pulsera Huawei band 6 nuevo,25000,20-07-2023,15:51:50,"Estación Central, Región Metropolitana"
Huawei P30 Lite,40000,20-07-2023,10:46:41,"Maipú, Región Metropolitana"
Huawei P30 Lite 128GB - 4 Ram - Impecable,100000,19-07-2023,14:55:34,"La Granja, Región Metropolitana"
Huawei y6 usado,50000,19-07-2023,14:33:59,"Peñalolén, Región Metropolitana"
Huawei Watch GT 3 SE,100000,19-07-2023,11:57:08,"San Miguel, Región Metropolitana"
Huawei watch gt 2,75000,18-07-2023,23:55:18,"La Cisterna, Región Metropolitana"
Huawei nova 5T ,80000,17-07-2023,20:05:03,"Pudahuel, Región Metropolitana"
Batería Huawei Nexus 6p HB416683ECW,9900,17-07-2023,19:14:57,"Santiago, Región Metropolitana"
Batería HB386280ECW Huawei P10 Honor 9,7600,17-07-2023,19:12:11,"Santiago, Región Metropolitana"
Celular huawei p20lite para todas las compañías,45000,17-07-2023,17:48:58,"Peñalolén, Región Metropolitana"
Huawei P40 Lite ,80000,17-07-2023,16:34:47,"Santiago, Región Metropolitana"
Funda Huaweii P60 Pro. 3000 mil pesos las Dos,3000,16-07-2023,16:23:59,"Providencia, Región Metropolitana"
Huawei Y9s 2020 (Con Google),90000,16-07-2023,07:00:22,"Santiago, Región Metropolitana"
Huawi Y9 2019 64GB Negro en perfecto estado,50000,15-07-2023,21:23:33,"Ñuñoa, Región Metropolitana"
Band 6 HUAWEI excelente ,20000,15-07-2023,14:42:09,"Santiago, Región Metropolitana"
Huawei psmart,50000,15-07-2023,13:38:55,"Las Condes, Región Metropolitana"
Huawei A70,50000,15-07-2023,08:17:09,"Maipú, Región Metropolitana"
Reloj Huawei Watch GT 2 de 46 mm,90000,14-07-2023,15:10:20,"Maipú, Región Metropolitana"
Huawei y9 Prime,40000,13-07-2023,01:49:20,"Quinta Normal, Región Metropolitana"
Celular Huawei P40 Lite usado con carcasa transpar,80000,12-07-2023,17:40:04,"La Florida, Región Metropolitana"
Huawei Mate 20 pro con pantalla quebrada,70000,12-07-2023,13:06:08,"Providencia, Región Metropolitana"
Hawei y9 2019,100000,11-07-2023,17:35:53,"Maipú, Región Metropolitana"
Huawei Nova 9 y smart watch,330000,10-07-2023,20:48:02,"San Miguel, Región Metropolitana"
Huawei Y8P,50000,08-07-2023,13:25:29,"San Miguel, Región Metropolitana"
Huawei Band 6,20000,07-07-2023,18:08:32,"San Bernardo, Región Metropolitana"
Huawei Mate 40 pro,340000,07-07-2023,15:48:03,"La Florida, Región Metropolitana"
Huawei Mate 20 Pro Usado,230000,07-07-2023,15:42:08,"Providencia, Región Metropolitana"
Huawei p10,45000,07-07-2023,15:38:15,"Macul, Región Metropolitana"
Huawei P40 como nuevo,250000,07-07-2023,09:57:19,"Ñuñoa, Región Metropolitana"
Huawei y9s,99990,06-07-2023,17:06:50,"Quinta Normal, Región Metropolitana"
Smart Band 7 Huawei,50000,05-07-2023,19:17:22,"Las Condes, Región Metropolitana"
Smartphone Huawei Nova 5T 128GB,280000,05-07-2023,12:12:57,"La Cisterna, Región Metropolitana"
Huawei Watch Fit Elegant casi nuevo,80000,04-07-2023,18:27:08,"Lo Barnechea, Región Metropolitana"
Huawei nova 5t,80000,04-07-2023,15:48:59,"Maipú, Región Metropolitana"
Reloj Inteligente Marca Huawei Modelo Watch gt 2,80000,03-07-2023,19:11:20,"Maipú, Región Metropolitana"
Huawei y7,40000,03-07-2023,17:58:44,"Las Condes, Región Metropolitana"
"Huawei Mate 20 lite liberado, muy buen estado",65000,03-07-2023,13:22:34,"Santiago, Región Metropolitana"
Celular Huawei Y9 Prime. Liberado. Cualquier Cía,100000,01-07-2023,16:45:26,"La Reina, Región Metropolitana"
"Huawei Watch GT2 Pro, Grey Titanium sin detalles",85000,01-07-2023,12:54:37,"La Cisterna, Región Metropolitana"
Teléfono Huawei P30lite,130000,01-07-2023,11:15:14,"Santiago, Región Metropolitana"
Huawei Y6,45000,30-06-2023,22:49:30,"Maipú, Región Metropolitana"
Huawei Nova Y60 NUEVO sin uso,85000,30-06-2023,09:05:14,"Ñuñoa, Región Metropolitana"
Huawei p30 lite 128gb,60000,29-06-2023,20:27:47,"Santiago, Región Metropolitana"
 Celular Huawei P20 Lite,45000,29-06-2023,18:21:52,"Santiago, Región Metropolitana"
Reloj inteligente smart watch fit huawei,62000,28-06-2023,05:30:46,"Peñaflor, Región Metropolitana"
"Reloj HUAWEI Watch Fit 1.64""",40000,27-06-2023,18:18:02,"Las Condes, Región Metropolitana"
Celular HUAWEI P40 Pro dualsim,290000,27-06-2023,04:49:05,"Cerro Navia, Región Metropolitana"
Huawei P Smart 2019,50000,26-06-2023,12:56:39,"Quinta Normal, Región Metropolitana"
Celular Huawei Y6 II,50000,25-06-2023,15:21:50,"San Miguel, Región Metropolitana"
Huawei p40 pro 5g,300000,25-06-2023,13:43:59,"Puente Alto, Región Metropolitana"
Huawei P40 lite liberado,65000,24-06-2023,14:37:27,"Santiago, Región Metropolitana"
Celular Huawei P30 128 GB y 8GB RAM como nuevo,140000,24-06-2023,13:26:25,"Providencia, Región Metropolitana"
Celular Huawei,50000,23-06-2023,15:00:52,"La Florida, Región Metropolitana"
Antena Rural Huawei ,80000,22-06-2023,23:20:58,"San Miguel, Región Metropolitana"
Huawei nova 9,285000,22-06-2023,23:16:24,"El Bosque, Región Metropolitana"
Huawei p40 nuevo dual sim liberado,200000,22-06-2023,18:14:15,"Providencia, Región Metropolitana"
Huawei novo9 se,90000,22-06-2023,07:51:47,"Estación Central, Región Metropolitana"
Huawei GT 2 nuevos sellados,65000,21-06-2023,20:22:16,"La Florida, Región Metropolitana"
Reloj Huawei watch GT 2e,60000,21-06-2023,11:36:28,"Cerrillos, Región Metropolitana"
Huawei Whatch Fit 2 Negro,80000,21-06-2023,11:03:58,"Ñuñoa, Región Metropolitana"
Celular HUAWEI P20 LITE,75000,20-06-2023,21:25:38,"Maipú, Región Metropolitana"
Huawei P Smart 2019,55000,20-06-2023,20:27:07,"Santiago, Región Metropolitana"
Huawei mate 20 lite,170000,20-06-2023,18:03:00,"Quilicura, Región Metropolitana"
Celular HUAWEI Mate10 Pro,20000,20-06-2023,10:14:14,"Pudahuel, Región Metropolitana"
Huawei mate 9 lite trizado,150000,20-06-2023,05:00:11,"Conchalí, Región Metropolitana"
Huawei P30 Lite 256 Gb Black 4g Leer Descripción,100000,19-06-2023,23:27:30,"Maipú, Región Metropolitana"
Huawei nova i8 128 gb,55000,19-06-2023,13:54:47,"Buin, Región Metropolitana"
Huawei watch GT-2,5000,19-06-2023,12:33:32,"Las Condes, Región Metropolitana"
Carcasas HUAWEI Y7P,100000,19-06-2023,04:09:37,"Santiago, Región Metropolitana"
Huawei Watch GT2 Pro,65000,19-06-2023,00:07:27,"Huechuraba, Región Metropolitana"
Huawei Y9 Prime 2019,140000,18-06-2023,21:37:16,"Puente Alto, Región Metropolitana"
Huawei Y9s (6 en ram y 128 en rom),65000,17-06-2023,15:28:33,"San Joaquín, Región Metropolitana"
Huawei P20 Lite,80000,16-06-2023,20:26:43,"Maipú, Región Metropolitana"
Celular Huawei,30000,16-06-2023,16:07:18,"Providencia, Región Metropolitana"
Huawei p20 lite,75000,16-06-2023,12:07:11,"Huechuraba, Región Metropolitana"
Celular Huawei mate 10pro,70000,15-06-2023,11:56:24,"La Florida, Región Metropolitana"
Huawei y9a,45000,15-06-2023,11:31:31,"San Bernardo, Región Metropolitana"
Reloj Huawei ,60000,14-06-2023,23:28:52,"Ñuñoa, Región Metropolitana"
Huawei p40 lite,69990,14-06-2023,22:22:35,"Estación Central, Región Metropolitana"
SMARTWATCH HUAWEI WATCH FIT 2 NEGRO Sellado,100000,14-06-2023,20:21:57,"Santiago, Región Metropolitana"
HUAWEI NOVA 9 se,45000,13-06-2023,21:58:42,"Providencia, Región Metropolitana"
teléfono Huawei en perfecto estado,80000,13-06-2023,21:49:58,"San Joaquín, Región Metropolitana"
Huawei Watch gt2,35000,13-06-2023,19:34:04,"Colina, Región Metropolitana"
Huawei Watch GT 2e,85000,13-06-2023,16:06:24,"Santiago, Región Metropolitana"
Smartphone Huawei Y5p,150000,13-06-2023,11:54:37,"Providencia, Región Metropolitana"
Huawei mate 20 Pro,100000,12-06-2023,18:39:14,"La Reina, Región Metropolitana"
Huawei Y9 prime usado buen estado,50000,12-06-2023,18:38:44,"Puente Alto, Región Metropolitana"
Reloj Huawei WATCH fit,60000,12-06-2023,16:17:34,"Lo Barnechea, Región Metropolitana"
Huawei Watch Fit Elegant,50000,11-06-2023,23:01:44,"Conchalí, Región Metropolitana"
Huawei y9 prime,50000,11-06-2023,15:00:44,"San Bernardo, Región Metropolitana"
Celular smart p20 huawei,170000,11-06-2023,13:35:59,"Quilicura, Región Metropolitana"
Huawei p30 Lite 250gb,30000,10-06-2023,21:26:56,"Conchalí, Región Metropolitana"
Celular barato huawei y6 2019,5900,10-06-2023,13:23:14,"Maipú, Región Metropolitana"
Lente Cristal Camara Huawei Mate 10 Lite,9800,08-06-2023,13:24:53,"Providencia, Región Metropolitana"
Flex de carga huawei mate 10 lite,6900,08-06-2023,12:37:53,"Providencia, Región Metropolitana"
Celular Huawei P30 Lite 128GB excelente estado,65000,07-06-2023,21:56:42,"Providencia, Región Metropolitana"
Celular Huawei P20 Lite Usado en excelente estado,80000,07-06-2023,19:44:58,"Santiago, Región Metropolitana"
Huawei Y6 2018,17000,06-06-2023,19:23:23,"La Florida, Región Metropolitana"
Teléfono Huawei 2019,20000,06-06-2023,18:03:45,"La Florida, Región Metropolitana"
Huawei p30 pro,200000,06-06-2023,16:52:30,"Peñalolén, Región Metropolitana"
Smartwatch Huawei Watch GT 2 Pro,130000,04-06-2023,20:39:02,"La Florida, Región Metropolitana"
Huawei p9,95000,04-06-2023,16:11:16,"San Miguel, Región Metropolitana"
Celular Hawei Y9s Ram6gb Negro,140000,04-06-2023,12:48:37,"Santiago, Región Metropolitana"
Huawei Nova 9 SE,180000,03-06-2023,21:19:44,"Pudahuel, Región Metropolitana"
Teléfono celular Huawei,100000,03-06-2023,19:34:52,"Huechuraba, Región Metropolitana"
Celular nuevo Huawei Nova Y70,100000,03-06-2023,11:23:57,"Santiago, Región Metropolitana"
Smartwatch huawei GT 2 46 mm,50000,02-06-2023,18:44:39,"La Florida, Región Metropolitana"
Smartwatch Huawei Watch FIT,50000,02-06-2023,18:36:57,"La Florida, Región Metropolitana"
Huawei modelo mrd-lx3,140000,02-06-2023,17:54:34,"Padre Hurtado, Región Metropolitana"
Huawei p20 pro 128gb negro 6 gb ram,100000,01-06-2023,10:49:35,"San Miguel, Región Metropolitana"
Huawei P30 lite,60000,31-05-2023,18:09:51,"La Florida, Región Metropolitana"
"Smart watch Huawei fit 6d4, usado",60000,30-05-2023,23:40:27,"La Reina, Región Metropolitana"
Huawei p smart 2019,380000,30-05-2023,21:04:15,"Puente Alto, Región Metropolitana"
Huawei mate 30 pro,120000,30-05-2023,19:38:36,"La Florida, Región Metropolitana"
Huawei P40 Lite,85000,30-05-2023,16:54:48,"Cerro Navia, Región Metropolitana"
Audifonos Huawei Freebuds Pro,70000,30-05-2023,12:49:05,"Estación Central, Región Metropolitana"
HUAWEI Y7a color negro  ,40000,29-05-2023,22:55:37,"San Miguel, Región Metropolitana"
Huawei y6,380000,29-05-2023,16:09:12,"Puente Alto, Región Metropolitana"
Huawei Mate 40 Pro,90000,28-05-2023,23:40:43,"La Florida, Región Metropolitana"
Huawei P40 ,140000,28-05-2023,17:43:18,"La Florida, Región Metropolitana"
Huawei P40 lite nuevo en caja sin ningún uso,35000,28-05-2023,12:19:58,"La Florida, Región Metropolitana"
Celular huawei y7 en buen estado funciona perfect,50000,28-05-2023,05:02:49,"Santiago, Región Metropolitana"
WiFi Router Huawei ,75000,26-05-2023,22:00:29,"La Florida, Región Metropolitana"
Huawei P30 lite,20000,26-05-2023,18:13:53,"Quinta Normal, Región Metropolitana"
Huawei y8s,50000,26-05-2023,10:58:42,"La Cisterna, Región Metropolitana"
Huawei P40 Lite pantalla trizada,70000,25-05-2023,18:49:16,"Las Condes, Región Metropolitana"
Celular huawei p20,70000,25-05-2023,07:30:42,"Santiago, Región Metropolitana"
Huawei p20 lite,70,24-05-2023,17:36:44,"Macul, Región Metropolitana"
Reloj Huawei watch gt 2,80000,23-05-2023,17:24:02,"Cerro Navia, Región Metropolitana"
Huawei Y7 2019,60000,23-05-2023,13:35:25,"Quilicura, Región Metropolitana"
Tablet Huawei,45000,23-05-2023,13:35:11,"Estación Central, Región Metropolitana"
Huawei p smart 2019,60000,23-05-2023,11:38:45,"San Joaquín, Región Metropolitana"
Oferta huawei,120000,22-05-2023,23:07:27,"Lo Prado, Región Metropolitana"
Reloj huawei gt watch runner,90000,21-05-2023,21:42:05,"Las Condes, Región Metropolitana"
Huawei p30 ,300000,21-05-2023,18:33:50,"Maipú, Región Metropolitana"
Huawei P30 Pro (usado) Con Android,110000,21-05-2023,12:52:33,"Lo Barnechea, Región Metropolitana"
Huawei y9a,85000,20-05-2023,21:49:38,"Quilicura, Región Metropolitana"
Smartwatch Huawei,160000,20-05-2023,16:46:07,"Maipú, Región Metropolitana"
Huawei Nova 9,120000,20-05-2023,16:39:35,"Maipú, Región Metropolitana"
Huawei Mate 10 pro 6GB/128GB/Dual SIM,90000,20-05-2023,14:35:19,"Santiago, Región Metropolitana"
Huawei Band 7,45000,19-05-2023,23:47:39,"Conchalí, Región Metropolitana"
Huawei p20 lite,100000,19-05-2023,13:39:45,"Santiago, Región Metropolitana"
Huawei mate 20 Lite dorado,70000,18-05-2023,22:16:57,"La Florida, Región Metropolitana"
Reloj HUAWEI Band 7,35000,18-05-2023,22:05:25,"San Joaquín, Región Metropolitana"
Celular Huawei P30 Lite Semi Nuevo,75000,17-05-2023,14:24:06,"Santiago, Región Metropolitana"
Huawei nova 8i 128 gb 6 de ram,150000,16-05-2023,04:20:14,"Santiago, Región Metropolitana"
Celular Huawei Y9a,120000,15-05-2023,16:03:24,"Maipú, Región Metropolitana"
Celular Motorola ONE ACTION + cargador HUAWEI,75000,15-05-2023,14:42:53,"Pedro Aguirre Cerda, Región Metropolitana"
Huawei mate 10 rne-l03,45000,14-05-2023,21:39:16,"Quilicura, Región Metropolitana"
Huawei P20 lite,50000,13-05-2023,23:29:05,"San Bernardo, Región Metropolitana"
Teléfono huawei y xiaomi,140000,12-05-2023,22:58:33,"Santiago, Región Metropolitana"
Tablet huawei mate pad,150000,12-05-2023,21:02:56,"San Miguel, Región Metropolitana"
Huawei nova 8i,20000,12-05-2023,12:04:34,"La Florida, Región Metropolitana"
Huawei Band 4 NUEVO,80000,11-05-2023,23:08:41,"La Florida, Región Metropolitana"
Huawei watch GT2 46mm,85000,11-05-2023,22:20:10,"Lo Barnechea, Región Metropolitana"
Huawei y9s,130000,11-05-2023,20:50:19,"Estación Central, Región Metropolitana"
Celular Huawei,110000,10-05-2023,00:10:03,"Pudahuel, Región Metropolitana"
Huawei gt 3,6900,09-05-2023,15:25:27,"Quilicura, Región Metropolitana"
Base Dock Cargador V8 Huawei Sony Motorola S7 S8 M,25000,09-05-2023,11:40:00,"Providencia, Región Metropolitana"
Pencil Huawei,70000,09-05-2023,05:42:29,"Colina, Región Metropolitana"
